district,schoolName,schoolAddress,medianResult,unit,lead,status,city,county,latitude,longitude
Cabrillo Unified,Alvin S. Hatch Elementary,490 Miramontes Avenue Half Moon Bay CA 94019-1824,NA,NA,NA,not tested,Half Moon Bay,San Mateo County,37.4632759454373,-122.436627675131
Cabrillo Unified,El Granada Elementary,400 Santiago Street Half Moon Bay CA 94019-5003,NA,NA,NA,not tested,NA,NA,NA,NA
Cabrillo Unified,Farallone View Elementary,250 LaConte and Kanoff Montara CA 94037-9999,NA,NA,NA,not tested,NA,NA,NA,NA
Cabrillo Unified,Farallone View Elementary School,1100 LeConte and Kanoff Montara CA 94037,NA,NA,NA,not tested,NA,NA,NA,NA
Cabrillo Unified,Half Moon Bay High,Lewis Foster Drive Half Moon Bay CA 94019,NA,NA,NA,not tested,Half Moon Bay,San Mateo County,37.4696543,-122.4321606
Cabrillo Unified,Manuel F. Cunha Intermediate,498 Kelly Avenue Half Moon Bay CA 94019-6102,NA,NA,NA,not tested,Half Moon Bay,San Mateo County,37.464182,-122.435665
Cabrillo Unified,Pilarcitos Alternative High (Continuation),498 Kelly Avenue Half Moon Bay CA 94019-6102,NA,NA,NA,not tested,Half Moon Bay,San Mateo County,37.464182,-122.435665
