district,schoolName,schoolAddress,medianResult,unit,lead,status,city,county,latitude,longitude
Sulphur Springs Union,Canyon Springs Community Elementary,19059 Vicci Street Canyon Country CA 91351-3380,NA,NA,FALSE,tested,Santa Clarita,Los Angeles County,34.4191181833784,-118.468214294454
Sulphur Springs Union,Fair Oaks Ranch Community,26933 North Silverbell Lane Santa Clarita CA 91387-3802,NA,NA,FALSE,tested,NA,NA,NA,NA
Sulphur Springs Union,Golden Oak Community,25201 Via Princessa Santa Clarita CA 91321-1429,NA,NA,FALSE,tested,Santa Clarita,Los Angeles County,34.3992208,-118.5327523
Sulphur Springs Union,Leona H. Cox Community Elementary,18643 Oakmoor Canyon Country CA 91351-2936,NA,NA,FALSE,tested,Santa Clarita,Los Angeles County,34.4269008686869,-118.459509262626
Sulphur Springs Union,Mint Canyon Community Elementary,16400 Sierra Highway Canyon Country CA 91351-1414,NA,NA,FALSE,tested,Santa Clarita,Los Angeles County,34.4056268,-118.4647824
Sulphur Springs Union,Mitchell Community Elementary,16821 West Goodvale Street Canyon Country CA 91387-1714,NA,NA,FALSE,tested,NA,NA,NA,NA
Sulphur Springs Union,Pinetree Community Elementary,29156 Lotusgarden Drive Canyon Country CA 91387-1840,NA,NA,FALSE,tested,NA,NA,NA,NA
Sulphur Springs Union,Sulphur Springs Community Elementary,16628 West Lost Canyon Road Canyon Country CA 91387-3241,NA,NA,FALSE,tested,NA,Los Angeles County,34.4104928,-118.4407358
Sulphur Springs Union,Valley View Community Elementary,19414 Sierra Estates Drive Newhall CA 91321-2196,NA,NA,FALSE,tested,NA,NA,NA,NA
