district,schoolName,schoolAddress,medianResult,unit,lead,status,city,county,latitude,longitude
Brawley Elementary,Barbara Worth Junior High,385 D Street Brawley CA 92227-1912,NA,NA,NA,not tested,Brawley,Imperial County,32.9809591710361,-115.53583500378
Brawley Elementary,J. W. Oakley Elementary,1401 B Street Brawley CA 92227-1912,NA,NA,NA,not tested,Brawley,Imperial County,32.9829812287151,-115.518811385989
Brawley Elementary,Miguel Hidalgo Elementary,615 South Cesar Chavez Street Brawley CA 92227-1912,NA,NA,NA,not tested,Brawley,Imperial County,32.97280675,-115.526471
Brawley Elementary,Myron D. Witter Elementary,150 K Street Brawley CA 92227-1912,NA,NA,NA,not tested,Brawley,Imperial County,32.9730349183673,-115.54052873469401
Brawley Elementary,Phil D. Swing Elementary,245 West A Street Brawley CA 92227-1912,NA,NA,NA,not tested,Brawley,Imperial County,32.9842481020408,-115.544759285714
